{
  "contractVersion": "host-guard/5.0.0-rc.1",
  "observationId": "00000000-0000-4000-8000-000000000001",
  "assetId": "00000000-0000-4000-8000-000000000002",
  "sensorId": "00000000-0000-4000-8000-000000000003",
  "bootId": "00000000-0000-4000-8000-000000000004",
  "captureScopeId": "00000000-0000-4000-8000-000000000005",
  "flowId": "00000000-0000-4000-8000-000000000006",
  "parentConnectionId": "00000000-0000-4000-8000-000000000006",
  "snapshotIndex": 0,
  "profile": "flow-prefix-v1",
  "environment": "research",
  "firstSeenAt": "2026-10-03T00:00:00Z",
  "asOf": "2026-10-03T00:00:01Z",
  "emittedAt": "2026-10-03T00:00:01.100000Z",
  "addressFamily": "ipv4",
  "transport": "tcp",
  "direction": "outbound",
  "serviceClass": "web",
  "servicePort": 443,
  "peerKey": "0000000000000000000000000000000000000000000000000000000000000000",
  "keyEpoch": 1,
  "targetRef": null,
  "targetExpiresAt": null,
  "features": {
    "elapsedMs": 1000,
    "bytesOutbound": 120,
    "bytesInbound": 60,
    "packetsOutbound": 2,
    "packetsInbound": 1,
    "lengthMin": 60,
    "lengthMax": 60,
    "lengthMean": 60,
    "lengthStd": 0,
    "iatMeanUs": 50000,
    "iatStdUs": 0,
    "synCount": 1,
    "synAckCount": 1,
    "rstCount": 0,
    "finCount": 0,
    "handshakeSeen": true
  },
  "contexts": [
    {
      "windowSeconds": 1,
      "coverageMs": 1000,
      "peerFlowStarts": 0,
      "peerSynCount": 0,
      "peerRstCount": 0,
      "peerDistinctServicePorts": 1,
      "hostFlowStarts": 0,
      "hostDistinctPeers": 1,
      "peerBytesOutbound": 60,
      "peerBytesInbound": 60
    },
    {
      "windowSeconds": 5,
      "coverageMs": 1000,
      "peerFlowStarts": 1,
      "peerSynCount": 1,
      "peerRstCount": 0,
      "peerDistinctServicePorts": 1,
      "hostFlowStarts": 1,
      "hostDistinctPeers": 1,
      "peerBytesOutbound": 120,
      "peerBytesInbound": 60
    },
    {
      "windowSeconds": 30,
      "coverageMs": 1000,
      "peerFlowStarts": 1,
      "peerSynCount": 1,
      "peerRstCount": 0,
      "peerDistinctServicePorts": 1,
      "hostFlowStarts": 1,
      "hostDistinctPeers": 1,
      "peerBytesOutbound": 120,
      "peerBytesInbound": 60
    }
  ],
  "quality": {
    "captureGap": false,
    "latePacket": false,
    "truncated": false,
    "offloadSuspected": false,
    "capacityDrop": false,
    "clockSkewMs": 0
  },
  "lastPacketAt": "2026-10-03T00:00:00.100000Z",
  "closeReason": null
}
